{
  "version": 1,
  "source_name": "elitetee_curated",
  "region": "United Kingdom & Ireland",
  "courses": [
    {
      "name": "Royal Birkdale Golf Club",
      "slug": "royal-birkdale-golf-club",
      "city": "Southport",
      "region": "England",
      "country": "United Kingdom",
      "course_type": "links",
      "access_type": "private",
      "architect": "George Lowe; Fred Hawtree",
      "year_opened": 1897,
      "holes": 18,
      "par": 70,
      "yardage": 7173,
      "website": "https://www.royalbirkdale.com",
      "description": "Championship links in Southport, England, routed through towering dunes on the Lancashire coast.",
      "latitude": 53.5556,
      "longitude": -3.0333
    },
    {
      "name": "Royal Liverpool Golf Club",
      "slug": "royal-liverpool-golf-club",
      "city": "Hoylake",
      "region": "England",
      "country": "United Kingdom",
      "course_type": "links",
      "access_type": "private",
      "architect": "Harry Colt; Fred Hawtree",
      "year_opened": 1869,
      "holes": 18,
      "par": 72,
      "yardage": 7341,
      "website": "https://www.royal-liverpool-golf.co.uk",
      "description": "Championship links at Hoylake on the Wirral Peninsula, one of England's oldest royal golf clubs.",
      "latitude": 53.3833,
      "longitude": -3.1833
    },
    {
      "name": "Royal Lytham & St Annes Golf Club",
      "slug": "royal-lytham-and-st-annes-golf-club",
      "city": "Lytham St Annes",
      "region": "England",
      "country": "United Kingdom",
      "course_type": "links",
      "access_type": "private",
      "architect": "George Lowe; Harry Colt",
      "year_opened": 1886,
      "holes": 18,
      "par": 70,
      "yardage": 7107,
      "website": "https://www.rltgolf.com",
      "description": "Championship links in Lancashire, England, set among dunes inland from the Fylde coast.",
      "latitude": 53.7417,
      "longitude": -3.0167
    },
    {
      "name": "Royal St George's Golf Club",
      "slug": "royal-st-georges-golf-club",
      "city": "Sandwich",
      "region": "England",
      "country": "United Kingdom",
      "course_type": "links",
      "access_type": "private",
      "architect": "Laidlaw Purves",
      "year_opened": 1894,
      "holes": 18,
      "par": 70,
      "yardage": 7204,
      "website": "https://www.royalstgeorges.com",
      "description": "Championship links at Sandwich on the Kent coast and regular Open Championship venue.",
      "latitude": 51.2733,
      "longitude": 1.4017
    },
    {
      "name": "Carnoustie Golf Links",
      "slug": "carnoustie-golf-links",
      "city": "Carnoustie",
      "region": "Angus",
      "country": "Scotland",
      "course_type": "links",
      "access_type": "public",
      "architect": "Allan Robertson; Old Tom Morris; James Braid",
      "year_opened": 1842,
      "holes": 18,
      "par": 72,
      "yardage": 7304,
      "website": "https://www.carnoustiegolflinks.co.uk",
      "description": "Public Championship Course links on Scotland's Angus coast, known for narrow fairways and the Barry Burn.",
      "latitude": 56.5017,
      "longitude": -2.7117
    },
    {
      "name": "Muirfield",
      "slug": "muirfield",
      "city": "Gullane",
      "region": "East Lothian",
      "country": "Scotland",
      "course_type": "links",
      "access_type": "private",
      "architect": "Old Tom Morris",
      "year_opened": 1891,
      "holes": 18,
      "par": 71,
      "yardage": 7245,
      "website": "https://www.themuirfield.co.uk",
      "description": "Private Honorable Company of Edinburgh Golfers course on East Lothian linksland at Gullane.",
      "latitude": 56.0417,
      "longitude": -2.825
    },
    {
      "name": "Trump Turnberry — Ailsa Course",
      "slug": "trump-turnberry-ailsa-course",
      "city": "Turnberry",
      "region": "South Ayrshire",
      "country": "Scotland",
      "course_type": "links",
      "access_type": "public",
      "architect": "Willie Fernie; Mackenzie Ross",
      "year_opened": 1906,
      "holes": 18,
      "par": 71,
      "yardage": 7448,
      "website": "https://www.turnberry.co.uk",
      "description": "Championship links on Scotland's Ayrshire coast with holes along the Firth of Clyde and views of Ailsa Craig.",
      "latitude": 55.3167,
      "longitude": -4.8333
    },
    {
      "name": "Royal Portrush Golf Club — Dunluce Links",
      "slug": "royal-portrush-dunluce-links",
      "city": "Portrush",
      "region": "Northern Ireland",
      "country": "United Kingdom",
      "course_type": "links",
      "access_type": "public",
      "architect": "Harry Colt; Donald Steel",
      "year_opened": 1889,
      "holes": 18,
      "par": 72,
      "yardage": 7344,
      "website": "https://www.royalportrushgolfclub.com",
      "description": "Championship links on Northern Ireland's Causeway Coast, with holes running through Atlantic dunes.",
      "latitude": 55.2017,
      "longitude": -6.6517
    },
    {
      "name": "Lahinch Golf Club",
      "slug": "lahinch-golf-club",
      "city": "Lahinch",
      "region": "County Clare",
      "country": "Ireland",
      "course_type": "links",
      "access_type": "public",
      "architect": "Old Tom Morris; Alister MacKenzie",
      "year_opened": 1895,
      "holes": 18,
      "par": 72,
      "yardage": 7052,
      "website": "https://lahinchgolf.com",
      "description": "Public links on Ireland's west coast in County Clare, exposed to Atlantic winds and famous for Klondyke and Dell holes.",
      "latitude": 52.9317,
      "longitude": -9.345
    },
    {
      "name": "Ballybunion Golf Club — Old Course",
      "slug": "ballybunion-old-course",
      "city": "Ballybunion",
      "region": "County Kerry",
      "country": "Ireland",
      "course_type": "links",
      "access_type": "public",
      "architect": "Tom Simpson; John Gerrard",
      "year_opened": 1893,
      "holes": 18,
      "par": 71,
      "yardage": 6802,
      "website": "https://www.ballybuniongolfclub.ie",
      "description": "Public Old Course links on the Atlantic coast of County Kerry, Ireland, with cliff-top holes above the beach.",
      "latitude": 52.5117,
      "longitude": -9.8517
    },
    {
      "name": "Royal Troon Golf Club",
      "slug": "royal-troon-golf-club",
      "city": "Troon",
      "region": "South Ayrshire",
      "country": "Scotland",
      "course_type": "links",
      "access_type": "private",
      "architect": "Willie Fernie; James Braid",
      "year_opened": 1878,
      "holes": 18,
      "par": 71,
      "yardage": 7156,
      "website": "https://www.royaltroon.co.uk",
      "description": "Championship Old Course links on Scotland's Ayrshire coast, noted for its short Postage Stamp par-3 eighth.",
      "latitude": 55.5433,
      "longitude": -4.655
    },
    {
      "name": "Royal Dornoch Golf Club",
      "slug": "royal-dornoch-golf-club",
      "city": "Dornoch",
      "region": "Highland",
      "country": "Scotland",
      "course_type": "links",
      "access_type": "public",
      "architect": "Old Tom Morris",
      "year_opened": 1877,
      "holes": 18,
      "par": 70,
      "yardage": 6726,
      "website": "https://www.royaldornoch.com",
      "description": "Public links in the Scottish Highlands above Dornoch Firth, among the oldest courses in the world.",
      "latitude": 57.8817,
      "longitude": -4.0267
    },
    {
      "name": "Wentworth Club — West Course",
      "slug": "wentworth-west-course",
      "city": "Virginia Water",
      "region": "England",
      "country": "United Kingdom",
      "course_type": "parkland",
      "access_type": "private",
      "architect": "Harry Colt",
      "year_opened": 1924,
      "holes": 18,
      "par": 72,
      "yardage": 7365,
      "website": "https://www.wentworthclub.com",
      "description": "Private Harry Colt heathland course in Surrey, England, and longtime home of the BMW PGA Championship.",
      "latitude": 51.3833,
      "longitude": -0.5833
    },
    {
      "name": "Sunningdale Golf Club — Old Course",
      "slug": "sunningdale-old-course",
      "city": "Sunningdale",
      "region": "England",
      "country": "United Kingdom",
      "course_type": "heathland",
      "access_type": "private",
      "architect": "Willie Park Jr.; Harry Colt",
      "year_opened": 1901,
      "holes": 18,
      "par": 70,
      "yardage": 6289,
      "website": "https://www.sunningdalegolfclub.co.uk",
      "description": "Private heathland course in Berkshire, England, routed through pine and birch across natural sandy ground.",
      "latitude": 51.4017,
      "longitude": -0.635
    },
    {
      "name": "Old Course at St Andrews",
      "slug": "old-course-at-st-andrews",
      "city": "St Andrews",
      "region": "Fife",
      "country": "Scotland",
      "course_type": "links",
      "access_type": "public",
      "holes": 18,
      "par": 72,
      "yardage": 7305,
      "website": "https://www.standrews.com/playing-st-andrews/old-course",
      "description": "Public links in St Andrews, Scotland, widely regarded as the oldest golf course in the world.",
      "latitude": 56.3438,
      "longitude": -2.8027
    }
  ]
}
