{
  "version": 1,
  "source_name": "elitetee_curated",
  "region": "foundation",
  "courses": [
    {
      "external_id": "elitetee-curated-national-golf-links-of-america",
      "legacy_external_id": "elitetee-seed-ngla",
      "name": "National Golf Links of America",
      "slug": "national-golf-links-of-america",
      "city": "Southampton",
      "region": "New York",
      "country": "United States",
      "course_type": "links",
      "access_type": "private",
      "elite_tier": "global_icon",
      "curated_tags": [
        "historic",
        "architecturally_significant",
        "private"
      ],
      "featured_status": "featured",
      "architect": "Charles Blair Macdonald; Seth Raynor",
      "year_opened": 1911,
      "holes": 18,
      "par": 72,
      "yardage": 6873,
      "website": "https://www.ngla.us",
      "description": "Private links course on Peconic Bay in Southampton, New York, built by C.B. Macdonald to evoke classic British links holes.",
      "latitude": 40.9039,
      "longitude": -72.4847
    },
    {
      "external_id": "elitetee-curated-pebble-beach-golf-links",
      "legacy_external_id": "elitetee-seed-pebble",
      "name": "Pebble Beach Golf Links",
      "slug": "pebble-beach-golf-links",
      "city": "Pebble Beach",
      "region": "California",
      "country": "United States",
      "website": "https://www.pebblebeach.com",
      "course_type": "links",
      "access_type": "public",
      "elite_tier": "global_icon",
      "curated_tags": [
        "championship",
        "links",
        "bucket_list",
        "public_access"
      ],
      "featured_status": "featured",
      "architect": "Jack Neville; Douglas Grant",
      "year_opened": 1919,
      "holes": 18,
      "par": 72,
      "yardage": 7075,
      "description": "Public seaside links on the Monterey Peninsula, routed along Carmel Bay and regularly used for major championships.",
      "latitude": 36.5686,
      "longitude": -121.9506
    },
    {
      "external_id": "elitetee-curated-bandon-dunes",
      "legacy_external_id": "elitetee-seed-bandon",
      "name": "Bandon Dunes",
      "slug": "bandon-dunes",
      "city": "Bandon",
      "region": "Oregon",
      "country": "United States",
      "website": "https://bandondunesgolf.com",
      "course_type": "links",
      "access_type": "public",
      "elite_tier": "destination",
      "curated_tags": [
        "resort",
        "links",
        "bucket_list",
        "public_access"
      ],
      "featured_status": "featured",
      "architect": "David McLay Kidd",
      "year_opened": 1999,
      "holes": 18,
      "par": 72,
      "yardage": 6732,
      "description": "Public links course on Oregon's coast at Bandon Dunes Golf Resort, set on dunes above the Pacific Ocean.",
      "latitude": 43.2347,
      "longitude": -124.39
    },
    {
      "external_id": "elitetee-curated-st-andrews-links",
      "legacy_external_id": "elitetee-seed-standrews",
      "name": "St Andrews Links",
      "slug": "st-andrews-links",
      "city": "St Andrews",
      "region": "Fife",
      "country": "Scotland",
      "website": "https://www.standrews.com/links",
      "course_type": "links",
      "access_type": "public",
      "elite_tier": "global_icon",
      "curated_tags": [
        "historic",
        "links",
        "bucket_list",
        "public_access"
      ],
      "featured_status": "featured",
      "description": "Public links golf trust in St Andrews, Scotland, operating seven courses on the town's shared linksland.",
      "latitude": 56.3398,
      "longitude": -2.7967
    },
    {
      "external_id": "elitetee-curated-cabot-cliffs",
      "legacy_external_id": "elitetee-seed-cabot",
      "name": "Cabot Cliffs",
      "slug": "cabot-cliffs",
      "city": "Inverness",
      "region": "Nova Scotia",
      "country": "Canada",
      "website": "https://cabotcapebreton.com",
      "course_type": "links",
      "access_type": "public",
      "elite_tier": "destination",
      "curated_tags": [
        "resort",
        "links",
        "bucket_list",
        "public_access"
      ],
      "featured_status": "featured",
      "architect": "Bill Coore; Ben Crenshaw",
      "year_opened": 2016,
      "holes": 18,
      "par": 72,
      "yardage": 6764,
      "description": "Public cliff-top links at Cabot Cape Breton in Nova Scotia, with holes along the Gulf of St. Lawrence.",
      "latitude": 46.2167,
      "longitude": -61.1167
    },
    {
      "external_id": "elitetee-curated-royal-county-down",
      "legacy_external_id": "elitetee-seed-rcd",
      "name": "Royal County Down",
      "slug": "royal-county-down",
      "city": "Newcastle",
      "region": "Northern Ireland",
      "country": "United Kingdom",
      "website": "https://www.rcdgolf.com",
      "course_type": "links",
      "access_type": "private",
      "elite_tier": "global_icon",
      "curated_tags": [
        "championship",
        "links",
        "historic",
        "private"
      ],
      "featured_status": "featured",
      "architect": "George L. Baillie; Old Tom Morris",
      "year_opened": 1890,
      "holes": 18,
      "par": 71,
      "yardage": 7183,
      "description": "Championship links in Newcastle, Northern Ireland, laid out through mountainous dunes with views of the Mourne Mountains.",
      "latitude": 54.2156,
      "longitude": -5.8847
    },
    {
      "external_id": "elitetee-curated-essex-county-country-club",
      "legacy_external_id": "elitetee-seed-essex",
      "name": "Essex County Country Club",
      "slug": "essex-county-country-club",
      "city": "Manchester-by-the-Sea",
      "region": "Massachusetts",
      "country": "United States",
      "course_type": "parkland",
      "access_type": "private",
      "elite_tier": "notable",
      "curated_tags": [
        "historic",
        "private"
      ],
      "architect": "Donald Ross",
      "year_opened": 1917,
      "holes": 18,
      "par": 71,
      "website": "https://www.essexcountycc.org",
      "description": "Private Donald Ross course on Massachusetts' North Shore, redesigned in 1917 on the club's Manchester-by-the-Sea property.",
      "latitude": 42.5081,
      "longitude": -70.7667
    },
    {
      "external_id": "elitetee-curated-liberty-national-golf-club",
      "legacy_external_id": "elitetee-seed-liberty",
      "name": "Liberty National Golf Club",
      "slug": "liberty-national-golf-club",
      "city": "Jersey City",
      "region": "New Jersey",
      "country": "United States",
      "course_type": "parkland",
      "access_type": "private",
      "elite_tier": "elite_private",
      "curated_tags": [
        "championship",
        "private"
      ],
      "architect": "Tom Kite; Bob Cupp",
      "year_opened": 2006,
      "holes": 18,
      "par": 71,
      "yardage": 7265,
      "website": "https://www.libertynational.com",
      "description": "Private championship course on New York Harbor in Jersey City with views of the Manhattan skyline.",
      "latitude": 40.6972,
      "longitude": -74.0531
    }
  ]
}
